Category,Subcategory,Action,Sentence
conv,none,none,what reason do you have for missing school?
conv,none,none,i was sick.
conv,none,none,how were you sick?
conv,none,none,i had a stomachache.
conv,none,none,did it get any better?
conv,none,none,i'm still feeling under the weather.
conv,none,none,would you like anything for your stomach?
conv,none,none,i took something earlier.
conv,none,none,get better.
conv,none,none,why didn't you go to school yesterday?
conv,none,none,i stayed home because i wasn't feeling well.
conv,none,none,what was your problem?
conv,none,none,my stomach was bothering me.
conv,none,none,are you feeling any better?
conv,none,none,i'm still feeling a little sick.
conv,none,none,"i'm going to the store, would you like any pepto bismol?"
conv,none,none,that's okay.
conv,none,none,did you hear the good news?
conv,none,none,"no, i haven't."
conv,none,none,i got a promotion at my job.
conv,none,none,did you really?
conv,none,none,"seriously, i am so excited."
conv,none,none,"well, congratulations."
conv,none,none,thank you.
conv,none,none,i'm so happy for you.
conv,none,none,really?
conv,none,none,yes. you really deserved this.
conv,none,none,you think so?
conv,none,none,have you heard my good news?
conv,none,none,you haven't told me anything yet.
conv,none,none,i got a promotion at work earlier this week.
conv,none,none,is that right?
conv,none,none,it's the truth. i am really happy.
conv,none,none,congratulations on your promotion.
conv,none,none,thank you very much.
conv,none,none,i am really excited for you.
conv,none,none,are you really?
conv,none,none,i'm serious. you deserved this promotion.
conv,none,none,is that what you really think?
conv,none,none,"i haven't told you what happened yet, have i?"
conv,none,none,i haven't heard anything.
conv,none,none,"my boss offered me a promotion, and i took it."
conv,none,none,are you serious?
conv,none,none,"yes, i am really excited."
conv,none,none,that's great. congratulations.
conv,none,none,i appreciate that.
conv,none,none,you have no idea how happy i am for you.
conv,none,none,you look really nice today. 
conv,none,none,thank you. i just got this outfit the other day.
conv,none,none,"really, where did you get it?"
conv,none,none,i got it from macy's.
conv,none,none,it's really nice.
conv,none,none,"thanks again. you look nice today, too."
conv,none,none,thank you. i just got these shoes today.
conv,none,none,really? what kind of shoes are they?
conv,none,none,these are called all star chuck taylors.
conv,none,none,i really like those. how much did they cost?
conv,none,none,they were about forty dollars.
conv,none,none,i absolutely love what you're wearing today.
conv,none,none,you do? i just bought this outfit a couple days ago.
conv,none,none,"seriously, it looks really nice on you. where did you buy it from?"
conv,none,none,i bought it from the macy's at the santa anita mall.
conv,none,none,i really like that outfit.
conv,none,none,"thanks. i think you look nice today, too."
conv,none,none,thank you. i just bought these new shoes earlier today.
conv,none,none,those are nice. what are they?
conv,none,none,these are some chucks.
conv,none,none,those are great. how much were they?
conv,none,none,i got them for forty.
conv,none,none,i think that you look very cute today.
conv,none,none,is that right? this is a brand new outfit.
conv,none,none,what store did you get it from?
conv,none,none,i went to macy's and picked it out.
conv,none,none,i love your outfit right now.
conv,none,none,"well, i think you look nice today too."
conv,none,none,thanks. i found these new shoes earlier at the store.
conv,none,none,i think that those are some really nice shoes. what kind are they?
conv,none,none,these are chucks.
conv,none,none,your shoes look really nice. how much did you get them for?
conv,none,none,"tell me, what do you enjoy doing in your spare time?"
conv,none,none,i enjoy drawing and painting.
conv,none,none,you know how to draw and paint?
conv,none,none,"yes, i do."
conv,none,none,when did you learn how to do that?
conv,none,none,i learned back in high school.
conv,none,none,"oh, so you took an art class?"
conv,none,none,"yeah, i loved that class."
conv,none,none,i see that you're pretty talented.
conv,none,none,thank you very much.
conv,none,none,i wish i had a talent like that.
conv,none,none,what kinds of things do you like to do?
conv,none,none,i've always liked to draw and paint.
conv,none,none,i didn't know you knew how to draw and paint.
conv,none,none,i do it every once in a while.
conv,none,none,how long have you known how to do that?
conv,none,none,i first learned how to do it in high school.
conv,none,none,did you take some sort of art class or something?
conv,none,none,that was my favorite class.
conv,none,none,you have got to be talented.
conv,none,exit,"that's enough"
conv,none,exit,enough
conv,none,exit,"ok Ditto, that's enough talking"
conv,none,none,"can you elaborate more on the strain blue dream"